[
  {
    "id": "e09bb6b1-4c02-4236-a362-e6d34e1ede81",
    "name": "Oldřich Hájek",
    "givenName": "Oldřich",
    "familyName": "Hájek",
    "sortName": "Hájek Oldřich",
    "memberOf": [
      {
        "id": "e8833483-680f-435a-af44-b759327578c8"
      }
    ]
  },
  {
    "id": "c018060f-957b-4ff5-8593-cba753edb0e2",
    "name": "Patrik Kunčar",
    "givenName": "Patrik",
    "familyName": "Kunčar",
    "sortName": "Kunčar Patrik",
    "memberOf": [
      {
        "id": "46927f39-fffa-44de-aa6b-ee76f53052bf"
      }
    ]
  },
  {
    "id": "85077d27-8b6a-4c19-a0a4-2c43d294cf01",
    "name": "Jana Juřenčáková",
    "givenName": "Jana",
    "familyName": "Juřenčáková",
    "sortName": "Juřenčáková Jana",
    "memberOf": [
      {
        "id": "6f007ce1-2275-4abc-b38f-65913d78f7e6"
      }
    ]
  },
  {
    "id": "ed0451b2-ebe8-495e-a61e-c1a73602f967",
    "name": "David Rumpík",
    "givenName": "David",
    "familyName": "Rumpík",
    "sortName": "Rumpík David",
    "memberOf": [
      {
        "id": "8331b263-fda5-459d-b28c-ddb84f281963"
      }
    ]
  },
  {
    "id": "d645041f-4036-4890-a275-4bf3b23be6a4",
    "name": "Barbora Fojtáchová",
    "givenName": "Barbora",
    "familyName": "Fojtáchová",
    "sortName": "Fojtáchová Barbora",
    "memberOf": [
      {
        "id": "37a912ea-5bb0-476f-a124-6729ba67cc7e"
      }
    ]
  },
  {
    "id": "6887a248-e299-4438-b92d-61e9040ef96b",
    "name": "Zbyněk Ziggy Horváth",
    "givenName": "Zbyněk Ziggy",
    "familyName": "Horváth",
    "sortName": "Horváth Zbyněk Ziggy",
    "memberOf": [
      {
        "id": "15630910-e388-4038-bfeb-04781a6cf2d6"
      }
    ]
  }
]